Dataset_ID	Bioproject_ID	Record_Link	Publication_Title	Publication_Link	Month_Of_Publication	DOI	Used_In_Previous_Meta_Analysis	Lit_Search_Source	Data_Source	Sequencing_Type	Sequencing_Technology	Prospective_Study	Sample_Sites	Amplicon_Region	V1	V2	V3	V4	V5	V6	Forward_Primer	Reverse_Primer	DNA_Extraction_Kit	Read_Pairing	Trimming_Of_Reads_After_Acquisition	Bowtie2_Alignment_Sensitivity	Host_Genome_Index	MetaPhlAn_Database	Fw_Read_Trim_Position	Rv_Read_Trim_Position	ASV_Table_Length_Filter	Notes_From_Processing	Age_Range	Num_Samples	Num_Individuals	Num_Celiac_Samples	Num_GFD_Samples	Num_Prospective_Celiac_Samples	Longitudinal_Study	Country	Samples_With_Significant_Factors	Prospective_Studies	Shotgun_Studies	Study_Design_Description
16S_136_Nobel	PRJNA778253	https://www.ncbi.nlm.nih.gov/bioproject/778253	Lack of Effect of Gluten Challenge on Fecal Microbiome in Patients With Celiac Disease and Non-Celiac Gluten Sensitivity	https://journals.lww.com/ctg/fulltext/2021/12000/lack_of_effect_of_gluten_challenge_on_fecal.5.aspx	Dec-21	10.14309/ctg.0000000000000441	FALSE	NCBI SRA	NCBI SRA	16S	Illumina MiSeq	FALSE	stool	V3-V4			TRUE	TRUE			TCGTCGGCAGCGTCAGATGTGTATAAGAGACAGCCTACGGGNGGCWGCAG	GTCTCGTGGGCTCGGAGATGTGTATAAGAGACAGGACTACHVGGGTATCTAATCC	MagAttract PowerSoil DNA Kit	paired	FALSE	NA	NA	NA	0	275	437:467		34.5-76.5	136	25	56	55	NA	TRUE	USA	gluten challenge and NCWS	-	-	"stool microbiota of HC (no GFD at any point), CD  (previously on GFD) and NCWS (previously on GFD) at 5 timepoints before, during and after a 14 day gluten challenge"
16S_20_Rawson	PRJNA852582	https://www.ncbi.nlm.nih.gov/bioproject/852582	Celiac Disease and a Gluten-Free Diet Lead to Loss of Methanobrevibacter from the Gut Microbiome	https://www.urncst.com/index.php/urncst/article/view/393	Feb-23	10.26685/urncst.393	FALSE	NCBI SRA	NCBI SRA	16S	Illumina MiSeq	FALSE	stool	V3-V4			TRUE	TRUE			unavailable/unclear	unavailable/unclear	QIAamp PowerFecal DNA kit	paired	FALSE	NA	NA	NA	0	0	434:461	"used trimLeft=c(0,5) - the SRA is missing samples compared to publication"	18-65	20	20	7	12	NA	FALSE	USA	-	-	-	"stool microbiota of TCD, HC on GFD, and HC not on GFD"
16S_60_Shi	PRJNA890948	https://www.ncbi.nlm.nih.gov/bioproject/890948	Characteristics of gut microbiota and fecal metabolomes in patients with celiac disease in Northwest China	https://www.frontiersin.org/journals/microbiology/articles/10.3389/fmicb.2022.1020977/full	Nov-22	10.3389/fmicb.2022.1020977	FALSE	NCBI SRA	NCBI SRA	16S	Illumina NovaSeq 6000	FALSE	stool	V3-V4			TRUE	TRUE			341F (5?-CCTACGGGNGGCWGCAG-3?)	805R (5?-GACTACHVGGGTATCTAATCC-3?)	FastDNA Spin Kit for Soil	paired	FALSE	NA	NA	NA	0	0	433:467		19-65	60	60	30	0	NA	FALSE	China	-	-	-	stool microbiota of ACD and HC
16S_96_Quagliariello	PRJEB14943	https://www.ncbi.nlm.nih.gov/bioproject/412183	Effect of Bifidobacterium breve on the Intestinal Microbiota of Coeliac Children on a Gluten Free Diet	https://www.mdpi.com/2072-6643/8/10/660	Oct-16	10.3390/nu8100660	TRUE	NCBI SRA	NCBI SRA	16S	Illumina MiSeq	FALSE	stool	V3-V4			TRUE	TRUE			5? TCGTCGGCAGCGTCAGATGTGTATAAGAGACAGCCTACGGGNGGCWGCAG 3?	5? GTCTCGTGGGCTCGGAGATGTGTATAAGAGACAGGACTACHVGGGTATCTAATCC 3?	QIAamp DNA Stool Mini Kit	paired	FALSE	NA	NA	NA	295	205	438:466		Jan-19	96	56	80	80	NA	TRUE	Italy	-	-	-	"stool microbiota of TCD, HC, and some of those TCD after 3 months of probiotics (or placebo)"
16S_27_Fornasaro	NA	NA	Spectroscopic investigation of faeces with surface-enhanced Raman scattering: a case study with coeliac patients on gluten-free diet	https://link.springer.com/article/10.1007/s00216-022-03975-y	Mar-22	10.1007/s00216-022-03975-y	FALSE	Scopus	Shared via email	16S	Ion Torrent Pyrosequencing	FALSE	stool	V4				TRUE			515F (5'-CAGGACCAGGGTACGGTG-3')	806R (5'-CGCAGAGAGGCTCCGTG-3')	EZNA Stool Extraction Kit 	single	FALSE	NA	NA	NA	250	NA	None		4-15.5	27	27	19	10	NA	FALSE	Italy	-	-	-	"stool microbiota of ACD, TCD and HC"
16S_49_Turjeman	PRJEB63123	https://www.ncbi.nlm.nih.gov/bioproject/984891	Celiac the lone horse? An autoimmune condition without signals of microbiota dysbiosis	https://journals.asm.org/doi/10.1128/spectrum.01463-23	Aug-23	10.1128/spectrum.01463-23	FALSE	NCBI SRA	NCBI SRA	16S	Illumina MiSeq	FALSE	stool	V4				TRUE			515F-barcoded	806R-non-barcoded	PureLink Microbiome DNA Purification Kit	single	FALSE	NA	NA	NA	0	NA	None		Apr-49	49	37	19	10	NA	TRUE	Poland	-	-	-	"stool microbiota of ACD, their unaffected family members as HC, and some of the same ACD individuals after 6 and 12 months of GFD"
16S_102_Bodkhe	PRJNA385740	https://www.ncbi.nlm.nih.gov/bioproject/385740	Comparison of Small Gut and Whole Gut Microbiota of First-Degree Relatives With Adult Celiac Disease Patients and Controls	https://www.frontiersin.org/journals/microbiology/articles/10.3389/fmicb.2019.00164/full	Feb-19	10.3389/fmicb.2019.00164	TRUE	NCBI SRA	NCBI SRA	16S	Illumina MiSeq	FALSE	stool|duodenum	V4				TRUE			515F (5?-GTGCCAGCMGCCGCGGTAA-3?)	806R (5?-GGACTACHVGGGTWTCTAAT-3?)	DNeasy Blood & Tissue Kit	paired	Trimmomatic: TruSeq3-PE-2.fa	NA	NA	NA	240	235	303:328		Dec-55	102	62	37	0	NA	FALSE	India	-	-	-	"stool and duodenal microbiota of HC, ACD, and their unaffected family members as HC"
16S_50_Bibbo	PRJEB35028	https://www.ncbi.nlm.nih.gov/bioproject/646428	Fecal Microbiota Signatures in Celiac Disease Patients With Poly-Autoimmunity	https://www.frontiersin.org/journals/cellular-and-infection-microbiology/articles/10.3389/fcimb.2020.00349/full	Jul-20	10.3389/fcimb.2020.00349	FALSE	NCBI SRA	NCBI SRA	16S	Illumina MiSeq	FALSE	stool	V4				TRUE			515F (5'-GTGCCAGCMGCCGCGGTAA-3')	806R (5'-GGACTACHVGGGTWTCTAAT-3')	QIAamp DNA Stool Mini Kit	paired	FALSE	NA	NA	NA	0	0	282:307		18-60	50	50	50	50	NA	FALSE	Italy	other autoimmune conditions	-	-	stool microbiota of TCD with and without other autoimmune conditions
16S_227_Oscarsson	PRJNA732664	https://www.ncbi.nlm.nih.gov/bioproject/732664	Effects of Probiotic Bacteria Lactobacillaceae on the Gut Microbiota in Children With Celiac Disease Autoimmunity	https://www.frontiersin.org/journals/nutrition/articles/10.3389/fnut.2021.680771/full	Jun-21	10.3389/fnut.2021.680771	FALSE	NCBI SRA	NCBI SRA	16S	Illumina MiSeq	FALSE	stool	V3-V4			TRUE	TRUE			341F (5'-CCTACGGGNGGCWGCAG-3')	805R (5'-GACTACHVGGGTATCTAATCC-3')	Manual	paired	FALSE	NA	NA	NA	0	275	438:446		03-Jul	227	78	227	0	NA	TRUE	Sweden	-	-	-	"stool microbiota of ACD at 0, 3 and 6 months of 6 months of probiotics (or placebo)"
16S_5_Senicar	NA	NA	Comparison of Microbial Populations in Saliva and Feces from Healthy and Celiac Adolescents with Conventional and Molecular Approaches after Cultivation on Gluten-Containing Media	https://www.mdpi.com/2076-2607/9/11/2375	Nov-21	10.3390/microorganisms9112375	FALSE	Scopus	Shared via email	16S	Illumina MiSeq	FALSE	stool	V3-V4			TRUE	TRUE			341F (5'-CCTACGGGNGGCWGCAG-3')	805R (5'-GACTACHVGGGTATCTAATCC-3')	QIAamp DNA Stool Mini Kit	paired	FALSE	NA	NA	NA	0	275	439:466		13-16	5	5	5	5	NA	FALSE	Slovenia	-	-	-	"stool microbiota of TCD (the study did involve saliva and healthy controls, but those data were not available)"
16S_99_Lionetti	PRJNA923292	https://www.ncbi.nlm.nih.gov/bioproject/923292	Effects of the supplementation with a multispecies probiotic on clinical and laboratory recovery of children with newly diagnosed celiac disease	https://www.dldjournalonline.com/article/S1590-8658(23)00580-7/fulltext	Oct-23	10.1016/j.dld.2023.04.021	FALSE	NCBI SRA	NCBI SRA	16S	Illumina MiSeq	FALSE	stool	V3-V4			TRUE	TRUE			unavailable/unclear	unavailable/unclear	QIAamp DNA Stool Mini Kit	paired	FALSE	NA	NA	NA	0	0	437:466		Feb-16	99	96	99	39	NA	TRUE	Italy	-	-	-	"stool microbiota of ACD, and some of the same individuals 3 and 6 months later after GFD and probiotics (or placebo) for the first 12 weeks"
16S_80_Garcia	PRJNA401920	https://www.ncbi.nlm.nih.gov/bioproject/401920	First Insights into the Gut Microbiota of Mexican Patients with Celiac Disease and Non-Celiac Gluten Sensitivity	https://www.mdpi.com/2072-6643/10/11/1641	Nov-18	10.3390/nu10111641	TRUE	NCBI SRA	NCBI SRA	16S	Illumina MiSeq	FALSE	stool|duodenum	V4				TRUE			515F (5'-GTGYCAGCMGCCGCGGTAA-3')	806R (5'-GGACTACNVGGGTWTCTAAT-3') 	Wizard Genomic DNA Purification Kit	single	FALSE	NA	NA	NA	0	NA	288:295		21-73	80	30	19	36	NA	FALSE	Mexico	NCGS	-	-	"stool and duodenal microbiota of HC, CD and NCGS, and after 4 weeks of GFD, with many samples missing"
16S_119_Salamon	NA	https://portalwiedzy.cm-uj.krakow.pl/info/researchdata/UJCM77a8979a493e4aacbdceefa5121abbff/	Are there new biomarkers of the gastroduodenal microbiota useful in the diagnosis of coeliac disease in children?	https://brill.com/view/journals/bm/15/2/article-p165_4.xml	Apr-24	10.1163/18762891-bja00009	FALSE	Scopus	Public download	16S	Illumina MiSeq	FALSE	stomach|duodenum	V3-V4			TRUE	TRUE			341F (5?-CCTACGGGNGGCWGCAG-3?)	805R (5?-GACTACHVGGGTATCTAATCC-3?)	A&A Genomic Mini Kit	paired	FALSE	NA	NA	NA	295	210	438:467	sample 1249_S102 was excluded because no fw reads on the SRA	Feb-18	119	60	80	0	NA	FALSE	Poland	-	-	-	duodenal and gastric microbiota of ACD and HC
16S_27_Federica	PRJNA750525	https://www.ncbi.nlm.nih.gov/bioproject/750525	"Characterization of the ""gut microbiota-immunity axis"" and microbial lipid metabolites in atrophic and potential celiac disease"	https://www.frontiersin.org/journals/microbiology/articles/10.3389/fmicb.2022.886008/full	Sep-22	10.3389/fmicb.2022.886008	FALSE	NCBI SRA	NCBI SRA	16S	Illumina MiSeq	FALSE	duodenum	V3-V4			TRUE	TRUE			515F	806R 	DNeasy PowerLyzer PowerSoil Kit 	paired	FALSE	NA	NA	NA	0	0	438:468		17-56	27	27	17	0	NA	FALSE	Italy	possible celiac disease	-	-	duodenal microbiota of ACD and PCD
16S_24_Giacomin	PRJNA316208	https://www.ncbi.nlm.nih.gov/bioproject/316208	Changes in duodenal tissue-associated microbiota following hookworm infection and consecutive gluten challenges in humans with coeliac disease	https://www.nature.com/articles/srep36797	Nov-16	10.1038/srep36797	TRUE	NCBI SRA	NCBI SRA	16S	Illumina MiSeq	FALSE	duodenum	V3-V4			TRUE	TRUE			unavailable/unclear	unavailable/unclear	TRIzol Plus RNA Purification Kit	paired	FALSE	NA	NA	NA	0	215	400:430		22-75	24	12	24	6	NA	TRUE	Australia	hookworm	-	-	"duodenal microbiota of TCD, ACD, and the same TCD individuals 24 and 36 weeks later after NO GFD and hookworm infection"
16S_20_Caminero	PRJNA518891	https://www.ncbi.nlm.nih.gov/bioproject/518891	Duodenal bacterial proteolytic activity determines sensitivity to dietary antigen through protease-activated receptor-2	https://www.nature.com/articles/s41467-019-09037-9	Mar-19	10.1038/s41467-019-09037-9	FALSE	NCBI SRA	NCBI SRA	16S	Illumina MiSeq	FALSE	duodenum	V3			TRUE				341F (5?-CCTACGGGAGGCAGCAG-3?)	518R (5?-GTATTACCGCGGCTGCTGG-3?)	unavailable/unclear	paired	"Cutadapt: fwd_front=GTATTACCGCGGCTGCTGG, rev_front=CCTACGGGAGGCAGCAG"	NA	NA	NA	110	110	132:161	"Reverse complement ASVs, so flipped before taxonomic assignment and export in DADA2 script"	18-72	20	20	12	0	NA	FALSE	Canada	-	-	-	duodenal microbiota of ACD and HC
16S_179_Verdu	PRJNA812940	https://www.ncbi.nlm.nih.gov/bioproject/812940	Biogeographic Variation and Functional Pathways of the Gut Microbiota in Celiac Disease	https://www.gastrojournal.org/article/S0016-5085(22)00752-1/fulltext?referrer=https%3A%2F%2Fpubmed.ncbi.nlm.nih.gov%2F	Nov-22	10.1053/j.gastro.2022.06.088	FALSE	NCBI SRA	NCBI SRA	16S	Illumina MiSeq	FALSE	stool|duodenum	V3			TRUE				341F (5?-CCTACGGGAGGCAGCAG-3?)	518R (5?-GTATTACCGCGGCTGCTGG-3?)	Manual	paired	"Cutadapt: fwd_front=GTATTACCGCGGCTGCTGG, rev_front=CCTACGGGAGGCAGCAG"	NA	NA	NA	110	110	135:161	"V3 and V3-V4 in the same publication, but all 20 V3-V4 are healthy controls therefore we exlcuded them...  +     Reverse complement ASVs, so flipped before taxonomic assignment and export in DADA2 script"	27-72	179	179	95	0	NA	FALSE	Canada	-	-	-	stool and duodenal microbiota of ACD and HC
16S_25_Francavilla	PRJNA231837	https://www.ncbi.nlm.nih.gov/bioproject/231837	Salivary Microbiota and Metabolome Associated with Celiac Disease	https://journals.asm.org/doi/full/10.1128/aem.00362-14	May-14	10.1128/AEM.00362-14	TRUE	NCBI SRA	NCBI SRA	16S	454 Pyrosequencing	FALSE	saliva	V1-V3	TRUE	TRUE	TRUE				Gray28F (5?-TTTGATCNTGGCTCAG)	Gray519r (5?-GTNTTACNGCGGCKGCTG)	QIAamp BiOstic Bacteremia DNA Kit	single	FALSE	NA	NA	NA	450	NA	None		Jun-14	25	25	12	12	NA	FALSE	Italy	-	-	-	saliva microbiota of TCD and HC
16S_62_Tian	PRJNA321349	https://www.ncbi.nlm.nih.gov/bioproject/321349	Salivary Gluten Degradation and Oral Microbial Profiles in Healthy Individuals and Celiac Disease Patients	https://journals.asm.org/doi/10.1128/aem.03330-16	Mar-17	10.1128/AEM.03330-16	TRUE	NCBI SRA	NCBI SRA	16S	Illumina MiSeq	FALSE	saliva	V3-V4			TRUE	TRUE			341F (5'-AATGATACGGCGACCACCGAGATCTACACTATGGTAATTGTCCTACGGGAGGCAGCAG-3')	806R (5?-CAAGCAGAAGACGGCATACGAGATNNNNNNNNNNNNAGTCAGTCAGCCGGACTACHVGGGTWTCTAAT-3?)	MasterPure Gram-positive DNA purification kit 	single	FALSE	NA	NA	NA	0	NA	401:431	files came as singles despite being paired end sequencing	18-72	62	62	30	30	NA	FALSE	USA	-	-	-	saliva microbiota of TCD and HC
16S_56_Laffaldano	PRJNA371697	https://www.ncbi.nlm.nih.gov/bioproject/371697	Oropharyngeal microbiome evaluation highlights Neisseria abundance in active celiac patients	https://www.nature.com/articles/s41598-018-29443-1	Jul-18	10.1038/s41598-018-29443-1	TRUE	NCBI SRA	NCBI SRA	16S	Illumina MiSeq	FALSE	oropharynx	V4-V6				TRUE	TRUE	TRUE	CAGCAGCCGCGGTAATAC 	TGACGACAGCCATGC	Manual	paired	FALSE	NA	NA	NA	0	265	540:554	samples from other studies mixed into the SRA. only 56 in this study	Mar-66	56	56	36	22	NA	FALSE	Italy	-	-	-	"oropharyngeal microbiota of ACD, TCD and HC"
16S_38_Olivares	PRJEB23313	https://www.ncbi.nlm.nih.gov/bioproject/417406	Gut microbiota trajectory in early life may predict development of celiac disease	https://microbiomejournal.biomedcentral.com/articles/10.1186/s40168-018-0415-6	Feb-18	10.1186/s40168-018-0415-6	TRUE	NCBI SRA	NCBI SRA	16S	Illumina MiSeq	TRUE	stool	V1-V2	TRUE	TRUE					MiSeq-27F (5?-AATGATACGGCGACCACCGAGATCTACACTATGGTAATTCCAGMGTTYGATYMTGGCTCAG-3?)	MiSeq-338R (5?-CAAGCAGAAGACGGCATACGAGAT-barcode-AGTCAGTCAGAAGCTGCCTCCCGTAGGAGT-3?)	FastDNA Spin Kit for Soil	paired	FALSE	NA	NA	NA	225	195	297:335		0.333333-0.5	38	20	NA	NA	19	TRUE	Spain	-	TRUE	-	stool microbiota of infants at 4 and/or 6 months of age who do and do not develop celiac disease in the future
16S_1211_Milletich	PRJNA854900	https://www.ncbi.nlm.nih.gov/bioproject/854900	Gut microbiome markers in subgroups of HLA class II genotyped infants signal future celiac disease in the general population	https://www.frontiersin.org/journals/cellular-and-infection-microbiology/articles/10.3389/fcimb.2022.920735/full	Jul-22	10.3389/fcimb.2022.920735	FALSE	NCBI SRA	NCBI SRA	16S	Illumina MiSeq	TRUE	stool	V3-V4			TRUE	TRUE			341F 	806R	EZNA Stool Extraction Kit 	single	FALSE	NA	NA	NA	295	NA	None		01-Jan	1211	1211	NA	NA	26	FALSE	Sweden	-	TRUE	-	stool microbiota of 1-year-olds who do and do not develop celiac disease in the future
16S_58_Girdhar	PRJNA631001	https://www.ncbi.nlm.nih.gov/bioproject/631001	"Dynamics of the gut microbiome, IgA response, and plasma metabolome in the development of pediatric celiac disease"	https://microbiomejournal.biomedcentral.com/articles/10.1186/s40168-022-01429-2	Jan-23	10.1186/s40168-022-01429-2	FALSE	NCBI SRA	NCBI SRA	16S	Illumina MiSeq	TRUE	stool	V4				TRUE			unavailable/unclear	unavailable/unclear	MagAttract Microbial DNA Kit	paired	FALSE	NA	NA	NA	0	0	None		2.5-5	58	58	NA	NA	29	FALSE	Sweden	-	TRUE	-	stool microbiota of 2.5 and 5-year-olds who do and do not develop celiac disease in the future
SG_132_Francavilla	PRJNA904924	https://www.ncbi.nlm.nih.gov/bioproject/PRJNA904924	Gluten-free diet affects fecal small non-coding RNA profiles and microbiome composition in celiac disease supporting a host-gut microbiota crosstalk	https://www.tandfonline.com/doi/full/10.1080/19490976.2023.2172955	Feb-23	10.1080/19490976.2023.2172955	FALSE	NCBI SRA	NCBI SRA	SG	NovaSeq 6000	FALSE	stool	NA							NA	NA	DNeasy PowerSoil Pro Kit	paired	FALSE	sensitive-local	GRCh38_noalt_decoy_as	mpa_vJun23_CHOCOPhlAnSGB_202403_bt2	NA	NA	NA		19-78	132	132	66	51	NA	FALSE	Italy	-	-	TRUE	"stool microbiota of ACD, TCD and HC"
SG_80_Mouzan	PRJNA757365	https://www.ncbi.nlm.nih.gov/bioproject/757365	Viral dysbiosis in children with new-onset celiac disease	https://journals.plos.org/plosone/article?id=10.1371/journal.pone.0262108	Jan-22	10.1371/journal.pone.0262108	FALSE	NCBI SRA	NCBI SRA	SG	Illumina HiSeq 4000	FALSE	stool|duodenum	NA							NA	NA	Stool: DNeasy PowerSoil Pro Kit | Duodenum: ZymoBIOMICS DNA Miniprep Kit	paired	Trimmomatic: NexteraPE-PE.fa	sensitive-local	GRCh38_noalt_decoy_as	mpa_vJun23_CHOCOPhlAnSGB_202403_bt2	NA	NA	NA		2-17.2	80	79	40	0	NA	FALSE	Saudi Arabia	-	-	TRUE	stool and duodenal microbiota of ACD and HC
